{
  "$schema": "http://json-schema.org/draft-07/schema#",
  "$id": "https://openweight.org/schemas/program.schema.json",
  "title": "Program",
  "description": "A structured training program consisting of multiple weeks of workouts",
  "type": "object",
  "required": ["name", "weeks"],
  "additionalProperties": true,
  "properties": {
    "name": {
      "title": "Name",
      "description": "Name of the training program",
      "type": "string",
      "minLength": 1,
      "maxLength": 200,
      "examples": ["Starting Strength", "5/3/1 BBB", "GZCLP"]
    },
    "description": {
      "title": "Description",
      "description": "Detailed description of the program, its goals, and how to follow it",
      "type": "string",
      "maxLength": 50000
    },
    "author": {
      "title": "Author",
      "description": "Creator or source of the program",
      "type": "string",
      "maxLength": 200,
      "examples": ["Mark Rippetoe", "Jim Wendler", "Cody Lefever"]
    },
    "tags": {
      "title": "Tags",
      "description": "Categories or labels for the program",
      "type": "array",
      "items": {
        "type": "string",
        "maxLength": 50
      },
      "examples": [["strength", "beginner"], ["powerlifting", "intermediate"]]
    },
    "weeks": {
      "title": "Weeks",
      "description": "The weeks that make up this program",
      "type": "array",
      "minItems": 1,
      "items": {
        "$ref": "#/definitions/ProgramWeek"
      }
    }
  },
  "definitions": {
    "ProgramWeek": {
      "title": "ProgramWeek",
      "description": "A week of training within a program",
      "type": "object",
      "required": ["workouts"],
      "additionalProperties": true,
      "properties": {
        "name": {
          "title": "Name",
          "description": "Name or label for this week",
          "type": "string",
          "maxLength": 200,
          "examples": ["Week 1", "Deload Week", "5s Week"]
        },
        "notes": {
          "title": "Notes",
          "description": "Notes or instructions for this week",
          "type": "string",
          "maxLength": 10000
        },
        "workouts": {
          "title": "Workouts",
          "description": "The workout templates for this week",
          "type": "array",
          "minItems": 1,
          "items": {
            "$ref": "workout-template.schema.json"
          }
        }
      }
    }
  }
}
